{
  "data_kind": "numerical_simulation",
  "edge_models": [
    {
      "deployment_resource_bounds": {
        "max_gpu_energy_j": 1.2,
        "max_gpu_work_s": 0.03,
        "max_ingress_energy_j": 0.08,
        "max_ingress_work_s": 0.005,
        "max_result_size_bits": 4096,
        "max_vram_bytes": 805306368
      },
      "model_hash": "a267279c18000843a2aa284f93d6d6cd5cacfa8094448a035ddefc1097a57fbe",
      "model_id": "edge_fer_numerical_v1",
      "model_kind": "edge",
      "protocol_version": "anon-fer/1.0",
      "supported_devices": [],
      "supported_pipelines": [
        "pixelate_weak_numerical_v2",
        "pixelate_medium_numerical_v2",
        "pixelate_strong_numerical_v2",
        "blur_weak_numerical_v2",
        "blur_medium_numerical_v2",
        "blur_strong_numerical_v2",
        "generative_weak_numerical_v2",
        "generative_medium_numerical_v2",
        "generative_strong_numerical_v2",
        "diffusion_weak_numerical_v2",
        "diffusion_medium_numerical_v2",
        "diffusion_strong_numerical_v2"
      ],
      "supported_rsus": [
        "rsu-1",
        "rsu-2"
      ]
    }
  ],
  "evidence_status": "frozen_numerical_model",
  "local_models": [
    {
      "deployment_resource_bounds": {
        "max_dynamic_energy_j": 0.7,
        "max_memory_bytes": 268435456,
        "max_service_work_s": 0.08
      },
      "model_hash": "d83b5434a3f5e843305c9e0f14902865f8127c22812266b41cb0f9ed0ebc782a",
      "model_id": "local_fer_numerical_v1",
      "model_kind": "local",
      "protocol_version": "anon-fer/1.0",
      "supported_devices": [
        "vehicle_gpu_class_a",
        "vehicle_cpu_class_b"
      ],
      "supported_pipelines": [],
      "supported_rsus": []
    }
  ],
  "metadata": {
    "contains_real_images": false,
    "contains_real_measurements": false,
    "cost_normalization_hash": "8da5af9b651924a5451cf45eb61f6bf8268058e818f88754c394f6b758a5f96e",
    "evidence_hash": "9eb6c79730fec09f781c255f91c9da6deb02b04c8bdb2a239031916437afa04a",
    "formal_experiment_eligible": false,
    "generator": "privacy_edge_sim.numerical.generate_numerical_study",
    "numerical_experiment_eligible": true,
    "quality_classifier_hash": "f3b51625a23b76e24b66913dc52a2f8249161f167670fa7db44a18ff7323a473",
    "quality_conformal_id": "numerical-quality-conformal-2.0.0",
    "quality_partition_hash": "81ae00a73e56bd4d56277b3b51cebeb45f74d46d7f743c4ef7edcb14eba284f2",
    "quality_regions": [
      {
        "coarse_class_probabilities": {
          "challenging": 0.018181818,
          "clear": 0.981818182
        },
        "mean_quality_score": 0.720113928,
        "region_id": "quality-region-000",
        "subject_count": 22
      },
      {
        "coarse_class_probabilities": {
          "challenging": 0.977777778,
          "clear": 0.022222222
        },
        "mean_quality_score": 0.48962686,
        "region_id": "quality-region-001",
        "subject_count": 20
      }
    ],
    "split_manifest_hash": "59a6509cab60098abaf6c0d1de0410bdfeca1f02b32412cb87060e73d7dab613",
    "warning": "FROZEN NUMERICAL MODEL - NOT HARDWARE OR ATTACK MEASUREMENT"
  },
  "online_mutable": false,
  "parameter_sources": {
    "deployment_resource_bounds": {
      "category": "engineering_assumption",
      "description": "Preregistered analytic finite physical envelopes over all allowed numerical variability controls; trace rows outside them are OOD.",
      "unit": "resource_busy_s,J,bytes,bit"
    },
    "emission_support": {
      "category": "engineering_assumption",
      "description": "Numerical guard emission lower confidence bounds.",
      "unit": "probability"
    },
    "privacy_bounds": {
      "category": "engineering_assumption",
      "description": "Recomputed from stored numerical subject outcomes using simultaneous Bonferroni-Hoeffding bounds.",
      "unit": "probability"
    },
    "retry_limits": {
      "category": "engineering_assumption",
      "description": "Finite numerical transaction retry cap.",
      "unit": "attempts"
    },
    "subject_support": {
      "category": "engineering_assumption",
      "description": "Mutually exclusive numerical profile-evaluation subjects.",
      "unit": "subjects"
    }
  },
  "pipelines": [
    {
      "deployment_resource_bounds": {
        "max_anon_energy_j": 0.7224,
        "max_anon_work_s": 0.0516,
        "max_encode_energy_j": 0.06,
        "max_encode_work_s": 0.012,
        "max_guard_energy_j": 0.06,
        "max_guard_work_s": 0.01,
        "max_output_bytes": 103000,
        "max_peak_memory_bytes": 100663296
      },
      "encoder_hash": "e161ec96de027271c055140ea3b3a2e801ca73cbe8d4f54762a581ad30abcedf",
      "encoder_id": "jpeg_numerical_v1",
      "fallback_local_model": "local_fer_numerical_v1",
      "guard_hash": "a4d5e33c71adea61801a472fe159dc8101883214a69c012f606fa6b767296f9a",
      "guard_id": "guard_numerical_v1",
      "max_attempts": 3,
      "pipeline_hash": "133d3ebd6aae15f234255e0e5fe621ad73f8c86803bdda3a11f02c0e7de328a3",
      "pipeline_id": "pixelate_weak_numerical_v2",
      "protocol_version": "anon-fer/1.0",
      "retryable_reasons": [
        "ANON_OOM",
        "ANON_FAILED",
        "GUARD_REJECTED",
        "ENCODE_FAILED"
      ],
      "supported_devices": [
        "vehicle_gpu_class_a",
        "vehicle_cpu_class_b"
      ]
    },
    {
      "deployment_resource_bounds": {
        "max_anon_energy_j": 0.84,
        "max_anon_work_s": 0.06,
        "max_encode_energy_j": 0.06,
        "max_encode_work_s": 0.012,
        "max_guard_energy_j": 0.06,
        "max_guard_work_s": 0.01,
        "max_output_bytes": 103000,
        "max_peak_memory_bytes": 100663296
      },
      "encoder_hash": "e161ec96de027271c055140ea3b3a2e801ca73cbe8d4f54762a581ad30abcedf",
      "encoder_id": "jpeg_numerical_v1",
      "fallback_local_model": "local_fer_numerical_v1",
      "guard_hash": "a4d5e33c71adea61801a472fe159dc8101883214a69c012f606fa6b767296f9a",
      "guard_id": "guard_numerical_v1",
      "max_attempts": 3,
      "pipeline_hash": "33a361c5ecf16a8d2cf32ca623d31c46af663e4b2f8113e92238843f77548fdd",
      "pipeline_id": "pixelate_medium_numerical_v2",
      "protocol_version": "anon-fer/1.0",
      "retryable_reasons": [
        "ANON_OOM",
        "ANON_FAILED",
        "GUARD_REJECTED",
        "ENCODE_FAILED"
      ],
      "supported_devices": [
        "vehicle_gpu_class_a",
        "vehicle_cpu_class_b"
      ]
    },
    {
      "deployment_resource_bounds": {
        "max_anon_energy_j": 1.0248,
        "max_anon_work_s": 0.0732,
        "max_encode_energy_j": 0.06,
        "max_encode_work_s": 0.012,
        "max_guard_energy_j": 0.06,
        "max_guard_work_s": 0.01,
        "max_output_bytes": 103000,
        "max_peak_memory_bytes": 100663296
      },
      "encoder_hash": "e161ec96de027271c055140ea3b3a2e801ca73cbe8d4f54762a581ad30abcedf",
      "encoder_id": "jpeg_numerical_v1",
      "fallback_local_model": "local_fer_numerical_v1",
      "guard_hash": "a4d5e33c71adea61801a472fe159dc8101883214a69c012f606fa6b767296f9a",
      "guard_id": "guard_numerical_v1",
      "max_attempts": 3,
      "pipeline_hash": "2afa405dc2fba52de79d24a09aa884af66a27788c718dfbc2bff4322eaa8211e",
      "pipeline_id": "pixelate_strong_numerical_v2",
      "protocol_version": "anon-fer/1.0",
      "retryable_reasons": [
        "ANON_OOM",
        "ANON_FAILED",
        "GUARD_REJECTED",
        "ENCODE_FAILED"
      ],
      "supported_devices": [
        "vehicle_gpu_class_a",
        "vehicle_cpu_class_b"
      ]
    },
    {
      "deployment_resource_bounds": {
        "max_anon_energy_j": 0.97524,
        "max_anon_work_s": 0.06966,
        "max_encode_energy_j": 0.06,
        "max_encode_work_s": 0.012,
        "max_guard_energy_j": 0.06,
        "max_guard_work_s": 0.01,
        "max_output_bytes": 115000,
        "max_peak_memory_bytes": 100663296
      },
      "encoder_hash": "e161ec96de027271c055140ea3b3a2e801ca73cbe8d4f54762a581ad30abcedf",
      "encoder_id": "jpeg_numerical_v1",
      "fallback_local_model": "local_fer_numerical_v1",
      "guard_hash": "a4d5e33c71adea61801a472fe159dc8101883214a69c012f606fa6b767296f9a",
      "guard_id": "guard_numerical_v1",
      "max_attempts": 3,
      "pipeline_hash": "2598c3911a10bbf9f9822194ad00ece1eb9829df7fa88db48f47afcf61f39d35",
      "pipeline_id": "blur_weak_numerical_v2",
      "protocol_version": "anon-fer/1.0",
      "retryable_reasons": [
        "ANON_OOM",
        "ANON_FAILED",
        "GUARD_REJECTED",
        "ENCODE_FAILED"
      ],
      "supported_devices": [
        "vehicle_gpu_class_a",
        "vehicle_cpu_class_b"
      ]
    },
    {
      "deployment_resource_bounds": {
        "max_anon_energy_j": 1.134,
        "max_anon_work_s": 0.081,
        "max_encode_energy_j": 0.06,
        "max_encode_work_s": 0.012,
        "max_guard_energy_j": 0.06,
        "max_guard_work_s": 0.01,
        "max_output_bytes": 115000,
        "max_peak_memory_bytes": 100663296
      },
      "encoder_hash": "e161ec96de027271c055140ea3b3a2e801ca73cbe8d4f54762a581ad30abcedf",
      "encoder_id": "jpeg_numerical_v1",
      "fallback_local_model": "local_fer_numerical_v1",
      "guard_hash": "a4d5e33c71adea61801a472fe159dc8101883214a69c012f606fa6b767296f9a",
      "guard_id": "guard_numerical_v1",
      "max_attempts": 3,
      "pipeline_hash": "2300012b28880fc14109125a28401c2e96e61ae00dfeeee7c6771584bf73f831",
      "pipeline_id": "blur_medium_numerical_v2",
      "protocol_version": "anon-fer/1.0",
      "retryable_reasons": [
        "ANON_OOM",
        "ANON_FAILED",
        "GUARD_REJECTED",
        "ENCODE_FAILED"
      ],
      "supported_devices": [
        "vehicle_gpu_class_a",
        "vehicle_cpu_class_b"
      ]
    },
    {
      "deployment_resource_bounds": {
        "max_anon_energy_j": 1.38348,
        "max_anon_work_s": 0.09882,
        "max_encode_energy_j": 0.06,
        "max_encode_work_s": 0.012,